{
  "schemaVersion": "benchmark.model_manifest.v1",
  "modelId": "lfm25-1p2b-thinking-local",
  "displayName": "LFM2.5 1.2B Thinking Local",
  "provider": "Liquid AI",
  "runtime": "ollama",
  "runtimeModelName": "hf.co/LiquidAI/LFM2.5-1.2B-Thinking-GGUF:latest",
  "status": "available",
  "capabilities": [
    "structured-output",
    "intent-classification",
    "generic-classification",
    "generic-summarization",
    "generic-extraction"
  ],
  "qualifications": {
    "website_audit.lighthouse_handoff": {
      "priority_helper": "qualified"
    },
    "core.classify": {
      "default_worker": "qualified",
      "fast_worker": "qualified"
    },
    "core.summarize": {
      "default_worker": "qualified",
      "fast_worker": "qualified"
    },
    "core.extract": {
      "default_worker": "qualified",
      "fast_worker": "qualified"
    }
  },
  "notes": [
    "Local Ollama manifest generated from installed Hugging Face GGUF model.",
    "Qualified on core.classify, core.summarize, and core.extract generic capabilities as secondary fallback and fast worker."
  ]
}
